{
  "ai_overview": null,
  "sponsored_results": [],
  "organic_results": [
    {
      "position": 1,
      "title": "Cykellack och Färg köp det största och mest prisvärda!",
      "description": null,
      "domain": "hollandbikeshop.com",
      "url": "https://hollandbikeshop.com/sv-se/cykelverktyg-och-underhall/cykellack-och-farg/",
      "date": null,
      "rating": null,
      "site_links": []
    },
    {
      "position": 2,
      "title": "Hur du målar om din cykelram i 3 steg - Ekoï - EKOI",
      "description": null,
      "domain": "www.ekoi.com",
      "url": "https://www.ekoi.com/sv-se/blog/hur-du-malar-om-din-cykelram-i-3-steg",
      "date": null,
      "rating": null,
      "site_links": []
    },
    {
      "position": 3,
      "title": "Favoritcykel Färg : r/bicycling",
      "description": "Jag har matt svart, blank svart, och min hardtail mtb är orange och vit. Orange och vit vinner hela dagen.",
      "domain": "www.reddit.com",
      "url": "https://www.reddit.com/r/bicycling/comments/10wkyfv/favorite_bike_color/?tl=sv",
      "date": null,
      "rating": null,
      "site_links": []
    },
    {
      "position": 4,
      "title": "Vilken färg är bäst att använda när jag ska måla min cykel?",
      "description": "12 nov. 2017 — Sprayfärg med lack ovanpå i 8 lager, minst. Jag tror att färgen röd är bäst att använda. Citera.",
      "domain": "www.flashback.org",
      "url": "https://www.flashback.org/p62313546",
      "date": null,
      "rating": null,
      "site_links": []
    },
    {
      "position": 5,
      "title": "Sprayfärg på cykellack?",
      "description": "1 maj 2023 — Men här borde väl målet vara att få fram en så oattraktiv cykel som möjligt, så satsa på fasadakrylat eller nåt liknande. ... Får bli kompromissen ...",
      "domain": "happyride.se",
      "url": "https://happyride.se/forum/threads/sprayfarg-pa-cykellack.3696794/",
      "date": null,
      "rating": null,
      "site_links": []
    },
    {
      "position": 6,
      "title": "Måla cykel - Beckers",
      "description": "Hej Kerstin Tack för din fråga. Vi rekommenderar att du målar din cykel med Metallackfärg V. Tvätta av ytan noga med vår utomhustvätt.",
      "domain": "forum.beckers.se",
      "url": "https://forum.beckers.se/org/beckers/d/mala-cykel/",
      "date": null,
      "rating": null,
      "site_links": []
    },
    {
      "position": 7,
      "title": "Hur du målar om din cykelram i 3 steg - Ekoï",
      "description": "Ta reda på hur du kan måla om din cykel som ny i 3 steg. 1. Välj en kvalitetsfärg. Kvaliteten på den färg som används spelar en viktig roll! Se därför till ...",
      "domain": "www.ekoi.com",
      "url": "https://www.ekoi.com/sv-se/blog/hur-du-malar-om-din-cykelram-i-3-steg",
      "date": null,
      "rating": null,
      "site_links": []
    },
    {
      "position": 8,
      "title": "Måla om cykel - Spraymåla din cykel - Guider & Tips",
      "description": "7 juni 2022 — Vilken sprayfärg kan man måla om en cykel med? Vi rekommenderar att du väljer färg från Montana Gold eller Molotow Premium när du ska måla om ...",
      "domain": "hlstore.com",
      "url": "https://hlstore.com/guides-and-tips/mala-om-cykel-spraymala-din-cykel/",
      "date": null,
      "rating": null,
      "site_links": []
    },
    {
      "position": 9,
      "title": "Bästa sprayfärg för cykeln? : r/choppers",
      "description": "Nästan klar med cykeln. Ska måla i stort sett allt matt svart. Någon av er som spraymålat er cykel har några tips på vilken typ, märke osv. man ska ...",
      "domain": "www.reddit.com",
      "url": "https://www.reddit.com/r/choppers/comments/1b8xbow/best_rattle_cab_paint_for_the_bike/?tl=sv",
      "date": null,
      "rating": null,
      "site_links": []
    },
    {
      "position": 10,
      "title": "Målning och sprayfärg | 365 dagars öppet",
      "description": "Vilken färg används för en cykel? Vi säljer märket Spray.Bike som är ett bra och populärt märke som verkligen lämpar sig för att måla eller lacka en cykel.",
      "domain": "bikable.se",
      "url": "https://bikable.se/reservdelar/malning-sprayfarg",
      "date": null,
      "rating": null,
      "site_links": []
    },
    {
      "position": 11,
      "title": "cykellack!",
      "description": "21 juli 2010 — Så nu till fråga, vart kan man hitta lila/blå lack till en cykel? ska inte vara så dyr. Vill gärna veta hur man lackar en cykel på bästa sätt.",
      "domain": "www.freeride.se",
      "url": "https://www.freeride.se/forum/threads/cykellack.71052/",
      "date": null,
      "rating": null,
      "site_links": []
    }
  ],
  "faq_results": [
    {
      "position": 1,
      "question": "Vilken färg på cykel?",
      "answer": "Kvaliteten på den färg som används spelar en viktig roll! Se därför till att du väljer en högkvalitativ färg som klarar av dina många cykelturer. Välj också en sprayfärg som är lämplig för din cykelram. Vissa tillverkare, till exempel Spray Bike, erbjuder mångsidiga burkar för aluminium-, stål- och kolramar.",
      "citations": [
        {
          "position": 1,
          "title": "Hur du målar om din cykelram i 3 steg - Ekoï - EKOI",
          "domain": "ekoi.com",
          "url": "https://www.ekoi.com/sv-se/blog/hur-du-malar-om-din-cykelram-i-3-steg"
        }
      ]
    },
    {
      "position": 2,
      "question": "Vad kostar det att lacka en cykel?",
      "answer": "En riktig lackering kostar runt 400-1000. Pulverlackering kan kosta så lite som 50, men brukar ligga på 100-200.",
      "citations": [
        {
          "position": 1,
          "title": "Hur mycket kostar det att lackera om en cykel? : r/bicycling - Reddit",
          "domain": "reddit.com",
          "url": "https://www.reddit.com/r/bicycling/comments/2hlaaw/how_much_does_a_bike_paint_job_cost/?tl=sv"
        }
      ]
    },
    {
      "position": 3,
      "question": "Hur målar man en cykel?",
      "answer": "Instruktioner när du målar om din cykel - 4 steg Grunda cykeln med en metallprimer eller aluminiumprimer. Spraymåla cykeln, låt torka mellan lager och slipa bort eventuellt stänk eller rinndroppar. Lacka cykeln med önskad finish. Välj ett tvåkomponentslack om du vill ha extra slittålighet.",
      "citations": [
        {
          "position": 1,
          "title": "Måla om cykel - Spraymåla din cykel - Guider & Tips - Highlights",
          "domain": "hlstore.com",
          "url": "https://hlstore.com/guides-and-tips/mala-om-cykel-spraymala-din-cykel/"
        }
      ]
    },
    {
      "position": 4,
      "question": "Kan man förlora körkortet om man cyklar mot rött?",
      "answer": "Ja även då kan körkortet återkallas. Men för det hära så krävs det såklart ganska så mycket. Det räcker inte rakt av att man bara cyklar mot rött.",
      "citations": [
        {
          "position": 1,
          "title": "Kan man förlora körkortet för att man cyklar mot rött? Svar - Instagram",
          "domain": "instagram.com",
          "url": "https://www.instagram.com/reel/DPia_dDjNB0/?hl=sv"
        }
      ]
    }
  ],
  "related_searches": [
    "lack till cykel",
    "metallfärg till cykel",
    "ta bort färg från cykelram",
    "måla över rost cykel",
    "lacka om cykelram",
    "måla lådcykel"
  ]
}
