{
  "ai_overview": {
    "answer": "För att få den mest exakta och aktuella väderprognosen för Nykyrka, Motala, rekommenderas att du besöker SMHIs webbplats. SMHI erbjuder detaljerade prognoser som uppdateras regelbundet, vilket är viktigt för att fånga snabba väderomslag, enligt SMHIs kunskapsbank. Sök på SMHI: Gå till smhi.se och sök efter \"Nykyrka\" för 10-dygnsprognos, timme för timme, samt regn- och vindprognoser. Alternativ: Många använder även Yr.no som ofta anses ha bra, detaljerade prognoser . Viktigt att tänka på: Prognoser är mest tillförlitliga 1–3 dygn framåt i tiden, skriver Illvet.se. När nederbördsprognosen visar 50% eller högre, indikerar det en högre sannolikhet för regn, enligt SMHIs vädertolkning.",
    "citations": [
      {
        "position": 1,
        "title": "SMHIs webbplats",
        "domain": "smhi.se",
        "url": "https://www.smhi.se/klimat/klimatet-da-och-nu/arets-och-arstidernas-vader"
      },
      {
        "position": 2,
        "title": "SMHIs kunskapsbank",
        "domain": "smhi.se",
        "url": "https://www.smhi.se/kunskapsbanken/meteorologi/vaderprognoser/varfor-kan-vaderprognoser-skilja-sig-at"
      },
      {
        "position": 3,
        "title": "Illvet.se",
        "domain": "illvet.se",
        "url": "https://illvet.se/naturen/vadret/hur-langt-framat-i-tiden-kan-man-forutsaga-vadret"
      },
      {
        "position": 4,
        "title": "SMHIs vädertolkning",
        "domain": "smhi.se",
        "url": "https://www.smhi.se/kunskapsbanken/meteorologi/vaderprognoser/tolka-smhis-vaderprognoser"
      },
      {
        "position": 5,
        "title": "Bästa väderappen: Här är de 3 mest exakta väderprognoserna",
        "domain": "pctidningen.se",
        "url": "https://pctidningen.se/program/app/de-3-basta-vadertjansterna"
      },
      {
        "position": 6,
        "title": "Tolka SMHIs väderprognoser — SMHI - Meteorologi",
        "domain": "smhi.se",
        "url": "https://www.smhi.se/kunskapsbanken/meteorologi/vaderprognoser/tolka-smhis-vaderprognoser#:~:text=Procentsiffran%20anger%20sannolikheten%20(risken/chansen)%20f%C3%B6r%20nederb%C3%B6rd.%20En,bakgrund%20och%20d%C3%A5%20visar%20%C3%A4ven%20v%C3%A4dersymbolen%20nederb%C3%B6rd."
      },
      {
        "position": 7,
        "title": "Hur långt framåt i tiden kan man förutsäga vädret? | illvet.se",
        "domain": "illvet.se",
        "url": "https://illvet.se/naturen/vadret/hur-langt-framat-i-tiden-kan-man-forutsaga-vadret#:~:text=Vissa%20v%C3%A4derprognoser%20str%C3%A4cker%20sig%2014%20dagar%20fram%C3%A5t,80%20procent%20av%20fallen%20tre%20dygn%20fram%C3%A5t"
      }
    ]
  },
  "sponsored_results": [],
  "organic_results": [
    {
      "position": 1,
      "title": "Väderprognos 10 dygn Nykyrka, Motala",
      "description": "Vädret 10 dagar framåt i Nykyrka, Motala. Väderprognos med vind, högsta (max) och lägsta (min) temperatur och solens upp- och nedgång. Väder helt enkelt.",
      "domain": "www.smhi.se",
      "url": "https://www.smhi.se/vader/prognoser-och-varningar/vaderprognos/q/Nykyrka/Motala/2687688",
      "date": null,
      "rating": null,
      "site_links": []
    },
    {
      "position": 2,
      "title": "Väderprognos 10 dygn Motala",
      "description": "Vädret 10 dagar framåt i Motala. Väderprognos med vind, högsta (max) och lägsta (min) temperatur och solens upp- och nedgång. Väder helt enkelt.",
      "domain": "www.smhi.se",
      "url": "https://www.smhi.se/vader/prognoser-och-varningar/vaderprognos/q/Motala/2690960",
      "date": null,
      "rating": null,
      "site_links": []
    },
    {
      "position": 3,
      "title": "Vädret i Nykyrka för 10 dygn. Jämför SMHI och YR",
      "description": "Vädret i Nykyrka, Motala, för 10 dagar. Jämför SMHI och YR sida vid sida. Långtidsprognos med dygnsnederbörd, max och min temperatur.",
      "domain": "www.vackertvader.se",
      "url": "https://www.vackertvader.se/nykyrka/tio-dygn",
      "date": null,
      "rating": null,
      "site_links": []
    },
    {
      "position": 4,
      "title": "Väderprognos 10 dygn Västra Ny, Motala",
      "description": "Vädret 10 dagar framåt i Västra Ny, Motala. Väderprognos med vind, högsta (max) och lägsta (min) temperatur och solens upp- och nedgång. Väder helt enkelt.",
      "domain": "www.smhi.se",
      "url": "https://www.smhi.se/vader/prognoser-och-varningar/vaderprognos/q/V%C3%A4stra%20Ny/Motala/2663852",
      "date": null,
      "rating": null,
      "site_links": []
    },
    {
      "position": 5,
      "title": "Väder Nykyrke - Östergötlands län: 14 dagar",
      "description": "14 dagars väder i Nykyrke, Östergötlands län. Väderprognos inkl. vind, max och min temperatur och solens upp- och nedgång.",
      "domain": "www.klart.se",
      "url": "https://www.klart.se/se/%C3%B6sterg%C3%B6tlands-l%C3%A4n/v%C3%A4der-nykyrke/",
      "date": null,
      "rating": null,
      "site_links": []
    },
    {
      "position": 6,
      "title": "Väderprognos 10 dygn Motala verkstad, Motala",
      "description": "för 2 dagar sedan — Vädret 10 dagar framåt i Motala verkstad, Motala. Väderprognos med vind, högsta (max) och lägsta (min) temperatur och solens upp- och ...",
      "domain": "www.smhi.se",
      "url": "https://www.smhi.se/vader/prognoser-och-varningar/vaderprognos/q/Motala%20verkstad/Motala/2690955",
      "date": null,
      "rating": null,
      "site_links": []
    },
    {
      "position": 7,
      "title": "SMHI Nykyrka",
      "description": "Timme för timme-prognos från SMHI för Nykyrka. I Nykyrka är det just nu -8 grader, mulet och friska vindar i byarna, enligt SMHI. Det blir mulet på morgonen.",
      "domain": "www.vackertvader.se",
      "url": "https://www.vackertvader.se/nykyrka/timmar/smhi",
      "date": null,
      "rating": null,
      "site_links": []
    },
    {
      "position": 8,
      "title": "Väderprognos 10 dygn Forsområdet, Motala",
      "description": "Vädret 10 dagar framåt i Forsområdet, Motala. Väderprognos med vind, högsta (max) och lägsta (min) temperatur och solens upp- och nedgång.",
      "domain": "www.smhi.se",
      "url": "https://www.smhi.se/vader/prognoser-och-varningar/vaderprognos/q/Forsomr%C3%A5det/Motala/6944539",
      "date": null,
      "rating": null,
      "site_links": []
    },
    {
      "position": 9,
      "title": "Väderprognos 10 dygn Fjuk, ö, Motala",
      "description": "Vädret 10 dagar framåt i Fjuk, ö, Motala. Väderprognos med vind, högsta (max) och lägsta (min) temperatur och solens upp- och nedgång. Väder helt enkelt.",
      "domain": "www.smhi.se",
      "url": "https://www.smhi.se/vader/prognoser-och-varningar/vaderprognos/q/Fjuk/Motala/2714617",
      "date": null,
      "rating": null,
      "site_links": []
    },
    {
      "position": 10,
      "title": "Väderprognos 10 dygn Sten, Motala",
      "description": "Vädret 10 dagar framåt i Sten, Motala. Väderprognos med vind, högsta (max) och lägsta (min) temperatur och solens upp- och nedgång. Väder helt enkelt.",
      "domain": "www.smhi.se",
      "url": "https://www.smhi.se/vader/prognoser-och-varningar/vaderprognos/q/Sten/Motala/2674313",
      "date": null,
      "rating": null,
      "site_links": []
    }
  ],
  "faq_results": [],
  "related_searches": [
    "smhi motala 14 dagar",
    "smhi motala 10 dagar",
    "smhi motala radar",
    "smhi motala djurkälla",
    "smhi motala verkstad",
    "väder motala yr"
  ]
}
