{
  "ai_overview": null,
  "sponsored_results": [
    {
      "position": 1,
      "advertiser": "HelloFresh™",
      "title": "Billig matkasse - Spara upp till 1099 kr och få gratis snacks i 3 månader",
      "description": null,
      "domain": "hellofresh.se",
      "url": "https://www.hellofresh.se/matkasse/billig",
      "site_links": [
        {
          "position": 1,
          "title": "Matkasse med hemleverans",
          "url": "https://www.hellofresh.se/matkasse/billig"
        },
        {
          "position": 2,
          "title": "Våra Matkassar",
          "url": "https://www.hellofresh.se/plans"
        },
        {
          "position": 3,
          "title": "Hur Det Funkar",
          "url": "https://www.hellofresh.se/how-it-works/"
        },
        {
          "position": 4,
          "title": "Välj Bland Veckans Recept",
          "url": "https://www.hellofresh.se/matkasse/veckans"
        },
        {
          "position": 5,
          "title": "Sveriges mest sålda matkasse",
          "url": "https://www.hellofresh.se/matkasse/billig"
        }
      ]
    },
    {
      "position": 2,
      "advertiser": "Hemköp",
      "title": "Matkasse hemleverans - Hämta själv eller hemkörning",
      "description": null,
      "domain": "hemkop.se",
      "url": "https://www.hemkop.se/handla",
      "site_links": []
    },
    {
      "position": 3,
      "advertiser": "Linas Matkasse",
      "title": "Matkassen utan bindningstid | Goda middagar med 30% rabatt",
      "description": null,
      "domain": "linasmatkasse.se",
      "url": "https://www.linasmatkasse.se/",
      "site_links": []
    },
    {
      "position": 4,
      "advertiser": "Mathem",
      "title": "Mat hemleverans | Hemleverans 7 dagar i veckan",
      "description": null,
      "domain": "mathem.se",
      "url": "https://www.mathem.se/",
      "site_links": []
    },
    {
      "position": 5,
      "advertiser": "HelloFresh™",
      "title": "HelloFresh - upp till 1099 kr | Matkasse med hemleverans",
      "description": null,
      "domain": "hellofresh.se",
      "url": "https://www.hellofresh.se/pages/inspiration-delivered",
      "site_links": []
    },
    {
      "position": 6,
      "advertiser": "Hemköp",
      "title": "Matkasse hemleverans",
      "description": null,
      "domain": "hemkop.se",
      "url": "https://www.hemkop.se/handla",
      "site_links": []
    }
  ],
  "organic_results": [
    {
      "position": 1,
      "title": "Linas Matkasse: Goda, hälsosamma matkassar med 30% rabatt!",
      "description": "Så funkar Linas Matkasse · 1. Välj dina middagar · 2. Leverans hem till dig · 3. Njut av god och sund mat.",
      "domain": "linasmatkasse.se",
      "url": "https://www.linasmatkasse.se/",
      "date": null,
      "rating": null,
      "site_links": []
    },
    {
      "position": 2,
      "title": "MATKASSE [2026] Jämför matkassar för hemleverans",
      "description": "Med hemleverans kan det i längden bli en lägre kostnad för maten då du minskar på svinn samt drar ner på okynnes köp. Sedan så innehåller matkassarna hög ...",
      "domain": "hitta-matkasse.se",
      "url": "https://hitta-matkasse.se/",
      "date": null,
      "rating": null,
      "site_links": []
    },
    {
      "position": 3,
      "title": "Mat hemleverans - Spara upp till 1099 kr och få gratis snacks i 3 månader",
      "description": "Läs mer om vår hemleverans av olika matkassar från HelloFresh. Laga exceptionellt goda middagar till dig och familjen med våra recept.",
      "domain": "hellofresh.se",
      "url": "https://www.hellofresh.se/matkasse/hemleverans",
      "date": null,
      "rating": null,
      "site_links": []
    },
    {
      "position": 4,
      "title": "Som en matkasse fast färdiglagad - Prenumerera på Svarta Lådan",
      "description": "Beställ din färdiga matkasse idag. Från 599 kr/vecka. Matlådor för hemleverans. Matlådor - välj meny. Prenumerera på Svarta Lådans nyttiga & goda matlådor.",
      "domain": "svartaladan.se",
      "url": "https://svartaladan.se/matkasse/",
      "date": null,
      "rating": null,
      "site_links": []
    },
    {
      "position": 5,
      "title": "Matkassar i Stockholm med hemleverans - Jamför pris & utbud",
      "description": "De flesta matkasseleverantörer erbjuder en kontaktlös leverans, vilket innebär att leverantören lämnar matkassen utanför din dörr och undviker direktkontakt.",
      "domain": "matkasse.com",
      "url": "https://www.matkasse.com/se/stockholm/",
      "date": null,
      "rating": null,
      "site_links": []
    },
    {
      "position": 6,
      "title": "Mathem: Handla mat online i din matbutik",
      "description": "Då bjuder vi på leveransen! Nu får du fri hemleverans i tre månader så länge du handlar minst varannan vecka. Smidigt va?",
      "domain": "mathem.se",
      "url": "https://www.mathem.se/",
      "date": null,
      "rating": null,
      "site_links": []
    },
    {
      "position": 7,
      "title": "Matkasse 2026: Jämför 50+ matkassar - Hemleverans till dörren.",
      "description": "Med rätt matkasse kommer en enklare vardag - se 26 leverantörer och alla deras matkassar. ✓Rabattkoder. ✓Omdömen. ✓Sortera & filtrera.",
      "domain": "middagskassen.se",
      "url": "https://middagskassen.se/",
      "date": null,
      "rating": null,
      "site_links": []
    },
    {
      "position": 8,
      "title": "beställ hem färdiga matkassar, snabbt & enkelt",
      "description": "Vi erbjuder matkassar för olika behov, som du enkelt kan växla mellan. Välj hemleverans eller avhämtning, abonnemang eller engångsköp. Hoppas det smakar!",
      "domain": "ica.se",
      "url": "https://www.ica.se/icas-matkasse/",
      "date": null,
      "rating": null,
      "site_links": []
    },
    {
      "position": 9,
      "title": "Alla matkassar med hemleverans i Sverige",
      "description": "Här har vi samlat matkassar från Sveriges alla leverantörer med hemleverans. Läs mer om varje företag och se vad de erbjuder här.",
      "domain": "hittamatkassen.se",
      "url": "https://hittamatkassen.se/alla-matkassar/",
      "date": null,
      "rating": null,
      "site_links": []
    },
    {
      "position": 10,
      "title": "Leverans matkassar - Hemleverans av mat - Hitta din matkasse",
      "description": "Leverantörer som erbjuder hemleverans · Linas Matkasse · HelloFresh · Matkomfort · Better Feast · GI-boxen · Mat & Ro · Årstiderna · Ecoviva. Ecoviva logga.",
      "domain": "hittadinmatkasse.se",
      "url": "https://hittadinmatkasse.se/leverans-matkasse/",
      "date": null,
      "rating": null,
      "site_links": []
    }
  ],
  "faq_results": [
    {
      "position": 1,
      "question": "Vilken matkasse är mest prisvärd?",
      "answer": null,
      "citations": []
    },
    {
      "position": 2,
      "question": "Vad kostar hemleverans av mat från ICA?",
      "answer": null,
      "citations": []
    },
    {
      "position": 3,
      "question": "Vad kostar hemkörning av mat från Willys?",
      "answer": null,
      "citations": []
    },
    {
      "position": 4,
      "question": "Vad kostar hemkörning av matvaror?",
      "answer": null,
      "citations": []
    }
  ],
  "related_searches": [
    "city gross matkasse hemleverans",
    "coop matkasse hemleverans",
    "ica matkasse hemleverans",
    "willys matkasse hemleverans",
    "coop matkasse",
    "citygross matkasse",
    "willys matkasse",
    "linas matkasse",
    "ica matkasse",
    "färdig matkasse",
    "matkasse recept",
    "matkasse prisjämförelse",
    "billig matkasse",
    "hellofresh matkasse",
    "middagsfrid matkasse"
  ]
}