{
  "ai_overview": null,
  "sponsored_results": [],
  "organic_results": [
    {
      "position": 1,
      "title": "AirPods Max 2",
      "description": "Den ultimata ljudupplevelsen med over ear-hörlurar – i fem livfulla färger och med upp till 1,5× mer aktiv brusreducering än tidigare generation.",
      "domain": "apple.com",
      "url": "https://www.apple.com/se/airpods-max/",
      "date": null,
      "rating": null,
      "site_links": [
        {
          "position": 1,
          "title": "Introduces AirPods Max 2",
          "url": "https://www.apple.com/newsroom/2026/03/apple-introduces-airpods-max-2-powered-by-h2/"
        },
        {
          "position": 2,
          "title": "Teknisk info",
          "url": "https://www.apple.com/se/airpods-max/specs/"
        }
      ]
    },
    {
      "position": 2,
      "title": "Airpods Max - köp din modell här",
      "description": "AirPods Max är en helt ny typ av over-ear-hörlurar. Ett Apple-designat element ger högupplöst ljud. Varje detalj, från öronkuddarna till textilnätet, har ...",
      "domain": "elgiganten.se",
      "url": "https://www.elgiganten.se/brand/apple/airpods/airpods-max",
      "date": null,
      "rating": null,
      "site_links": []
    },
    {
      "position": 3,
      "title": "Apple Airpods Max hörlurar, over ear – Tester och recensioner",
      "description": null,
      "domain": "test.se",
      "url": "https://www.test.se/horlurar/apple-airpods-max/",
      "date": null,
      "rating": null,
      "site_links": []
    },
    {
      "position": 4,
      "title": "Apple AirPods Max Wireless Over-ear Headset",
      "description": "Det billigaste priset för Apple AirPods Max Wireless Over-ear Headset just nu är 5 490 kr. Det är en av de 100 mest populära produkterna i kategorin Hörlurar ...",
      "domain": "prisjakt.nu",
      "url": "https://www.prisjakt.nu/produkt.php?p=5670733",
      "date": null,
      "rating": {
        "max_score": 5,
        "score": 3.9
      },
      "site_links": []
    },
    {
      "position": 5,
      "title": "Apple släpper en oväntad uppdatering av Airpods Max 2",
      "description": "16 mars 2026 — De nya hörlurarna ser likadana ut, finns i samma fem färger och levereras med samma kritiserade Smart Case – till samma pris på 6 495 kronor.",
      "domain": "macworld.se",
      "url": "https://www.macworld.se/article/3089811/airpods-max-2.html",
      "date": null,
      "rating": null,
      "site_links": []
    },
    {
      "position": 6,
      "title": "Apple AirPods Max 2020 blå - Hörlurar",
      "description": "Perfekt för musik, podcasts och samtal. Låg distorsion: Högkvalitativ ljudupplevelse även vid hög volym. Intuitiva kontroller: Justera volym, byt låt, svara på ...",
      "domain": "refurbed.se",
      "url": "https://www.refurbed.se/p/apple-airpods-max/",
      "date": null,
      "rating": null,
      "site_links": []
    },
    {
      "position": 7,
      "title": "Apple Airpods Max hörlurar, over ear – Tester och recensioner",
      "description": "Du kan streama ljud till två olika enheter. Med aktiv brusreducering och rumsligt ljud är batteritiden upp till 20 timmar. Hörlurarna finns i flera fina färger ...",
      "domain": "test.se",
      "url": "https://www.test.se/horlurar/apple-airpods-max/",
      "date": null,
      "rating": null,
      "site_links": []
    },
    {
      "position": 8,
      "title": "Apple AirPods Max - Midnight",
      "description": "AirPods Max är lika trådlösa och magiskt enkla som resten av AirPods-familjen och ansluts direkt till din iPhone eller iPad. Håll bara AirPods Max nära din ...",
      "domain": "scandinavianphoto.se",
      "url": "https://www.scandinavianphoto.se/apple/airpods-max---blue-1102387",
      "date": null,
      "rating": null,
      "site_links": []
    },
    {
      "position": 9,
      "title": "Apple AirPods Max - Midnight",
      "description": "AirPods Max, den ultimata ljudupplevelsen. Nu i fem nya färger. Apple-designat högtalarelement ger högupplöst ljud. Varje detalj från bygel till öronkuddar ...",
      "domain": "netonnet.se",
      "url": "https://www.netonnet.se/art/ljud/horlurar/tradlosahorlurar/apple-airpods-max-midnight/1035503.9296/",
      "date": null,
      "rating": null,
      "site_links": []
    },
    {
      "position": 10,
      "title": "TEST: Apple AirPods Max 2",
      "description": "för 1 dag sedan — AirPods Max visade sig nämligen vara hifi-lurar som kunde mäta sig med de bästa trådlösa lurarna med brusreducering. Men de hade sina nackdelar.",
      "domain": "ljudochbild.se",
      "url": "https://www.ljudochbild.se/test/datorer/apple-airpods-max-2/",
      "date": null,
      "rating": null,
      "site_links": []
    }
  ],
  "faq_results": [
    {
      "position": 1,
      "question": "Är AirPods Max värt det?",
      "answer": "Är du Applefantast rekommenderar vi Apple Airpods Max som passar fint till iPhone och dina andra Apple-enheter. Apples första heltäckande hörlurar kom 2020 och sedan dess har man år efter år utsetts till det bästa valet för dig med iPhone.",
      "citations": [
        {
          "position": 1,
          "title": "Apple Airpods Max hörlurar, over ear – Tester och recensioner",
          "domain": "test.se",
          "url": "https://www.test.se/horlurar/apple-airpods-max/"
        }
      ]
    },
    {
      "position": 2,
      "question": "Vad är skillnaden på AirPods Max 2020 och 2024?",
      "answer": "Enda skillnaden är färgvarianter och USB-C eller Lightning-kabel. De är samma förutom färg och kabel. Ingenting är annorlunda, bara USB-C.",
      "citations": [
        {
          "position": 1,
          "title": "AirPods Max 2020 vs 2024? : r/Airpodsmax - Reddit",
          "domain": "reddit.com",
          "url": "https://www.reddit.com/r/Airpodsmax/comments/1h297v8/airpods_max_2020_vs_2024/?tl=sv"
        }
      ]
    },
    {
      "position": 3,
      "question": "När kommer AirPods Max 2?",
      "answer": null,
      "citations": []
    },
    {
      "position": 4,
      "question": "Vilka AirPods Max är bäst?",
      "answer": "Om du vill ha de bästa in-ear-funktionerna och hälsomätningar – AirPods Pro 3. Om du vill ha over-ear-lyx till ett bra pris – AirPods Max (1:a generationen). Om du vill ha den absolut bästa brusreduceringen och de senaste smarta funktionerna – AirPods Max 2.",
      "citations": [
        {
          "position": 1,
          "title": "Apple AirPods: Köpguide 2026 - Multitronic",
          "domain": "multitronic.fi",
          "url": "https://www.multitronic.fi/sv/airpods-guide"
        }
      ]
    }
  ],
  "related_searches": [
    "apple airpods max elgiganten",
    "apple airpods max grön",
    "apple airpods max rosa",
    "apple airpods max prisjakt",
    "apple airpods max 2025",
    "apple airpods max netonnet",
    "apple airpods max 2020",
    "apple airpods max 3",
    "airpods max 2",
    "airpods max silver"
  ]
}